<?xml version="1.0" encoding="utf-8"?>

<produkcjaMuzyki xmlns:xsi="http://www.w3.org/2001/XMLSchema-instance" xsi:noNamespaceSchemaLocation="schemat.xsd">
  <elektroniczne>
    <DAWs>
      <opis>
        Daw, ang. digital audio interface, po polsku cyfrowa stacja robocza jest to program komputerowy przeznaczony do pracy z dźwiękiem, bardzo często wykorzystywany przy współczenej produkcji muzyki. Ich celem jest zastąpienie pełnowymiarowych konsol znajdujących się w studiach nagraniowych, tak aby większość obróbki dźwięku następowała na komputerze. Jest to rozwiązanie znacznie tańsze i wygodniejsze, a przede wszystkim bardziej dostępne dla ludzi pragnących zając się produkcją muzyki w sposób hobbistyczny.
      </opis>
      <DAW nazwa="FL Studio">
        <minCena waluta="zł">
          349.00
        </minCena>
        <maxCena waluta="zł">
          2249.00
        </maxCena>
        <przewidywana>średnia</przewidywana>
        <wydawca link="https://www.image-line.com/">
          Image line
        </wydawca>
      </DAW>
      
      <DAW nazwa="Ableton Live">
        <minCena waluta="eur">
          79.00
        </minCena>
        <maxCena waluta="eur">
          599.00
        </maxCena>
        <przewidywana>200.00</przewidywana>
        <wydawca link="https://www.ableton.com/">
          Ableton
        </wydawca>
      </DAW>
      
      <DAW nazwa="Logic Pro">
        <cena waluta="usd">
          199.99
        </cena>
        <wydawca link="https://www.apple.com/">
          Apple
        </wydawca>
      </DAW>
      
      <DAW nazwa="Cubase">
        <minCena waluta="zł">
          469.76
        </minCena>
        <maxCena waluta="zł">
          2720.16
        </maxCena>
        <przewidywana>góra</przewidywana>
        <wydawca link="https://www.steinberg.net/">
          Steinberg Media Technologies
        </wydawca>
      </DAW>
      
      <DAW nazwa="GarageBand">
        <cena>
          0
        </cena>
        <wydawca link="https://www.apple.com/">
          Apple
        </wydawca>
      </DAW>
    </DAWs>
    
    
    <pluginy>
      <opis>
        Pluginy, pluginy VST (ang. Virtual Studio Technology), czyli podprogramy otwierane w środowisku zapewnianym przez DAW, których celem jest tworzenie lub modyfikowanie dźwięku a nawet więcej. Pluginy rozróżniamy przede wszystkim na generujące i nakładające efekty, zazwyczaj DAW wyróżnia osobne miejsca do załączena dla obu typów.
      </opis>
      <plugin nazwa="3x OSC" typ="generujacy">
        <cena>
          0
        </cena>
        <wydawca link="https://www.image-line.com/">
          Image line
        </wydawca>
        <dzialanie>
          <synteza>
            oscylator
          </synteza>
          <synteza>
            synteza AM
          </synteza>
          <efekt>
            obwiednia
          </efekt>
        </dzialanie>
        <obraz src="graphics/fimg(1).png"/>
      </plugin>

      <plugin nazwa="Serum" typ="generujacy">
        <cena waluta="usd">
          189.00
        </cena>
        <wydawca link="https://xferrecords.com/">
          Xfer
        </wydawca>
        <dzialanie>
          <synteza>
            oscylator
          </synteza>
          <synteza>
            synteza AM
          </synteza>
          <synteza>
            synteza tablicowa
          </synteza>
          <synteza>
            sampler
          </synteza>
          <efekt>
            obwiednia
          </efekt>
          <efekt>
            korektor
          </efekt>
          <efekt>
            nasycenie
          </efekt>
          <efekt>
            echo
          </efekt>
          <efekt>
            pogłos
          </efekt>
        </dzialanie>
        <obraz src="graphics/fimg(2).png"/>
      </plugin>

      <plugin nazwa="Ample Guitar" typ="generujacy">
        <cena>
          0
        </cena>
        <wydawca link="https://www.amplesound.net/en/index.asp">
          Ample Sound
        </wydawca>
        <dzialanie>
          <synteza>
            sampler
          </synteza>
        </dzialanie>
        <obraz src="graphics/fimg(3).png"/>
      </plugin>

      <plugin nazwa="BBC Symphony Orchestra" typ="generujacy">
        <cena waluta="eur">
          599.00
        </cena>
        <wydawca link="https://www.spitfireaudio.com/">
          Spitfire Audio
        </wydawca>
        <dzialanie>
          <synteza>
            sampler
          </synteza>
        </dzialanie>
        <obraz src="graphics/fimg(4).png"/>
      </plugin>

      <plugin nazwa="Kick 2" typ="generujacy">
        <cena waluta="gbp">
          29.97
        </cena>
        <wydawca link="https://www.sonicacademy.com/">
          Sonic Academy
        </wydawca>
        <dzialanie>
          <synteza>
            oscylator
          </synteza>
          <synteza>
            sampler
          </synteza>
          <efekt>
            nasycenie
          </efekt>
        </dzialanie>
        <obraz src="graphics/fimg(5).png"/>
      </plugin>

      <plugin nazwa="Fruity Parametric EQ 2" typ="efekt">
        <cena>
          0
        </cena>
        <wydawca link="https://www.image-line.com/">
          Image Line
        </wydawca>
        <dzialanie>
          <efekt>
            korektor
          </efekt>
        </dzialanie>
        <obraz src="graphics/fimg(6).png"/>
      </plugin>

      <plugin nazwa="Fruity Delay 3" typ="efekt">
        <cena>
          0
        </cena>
        <wydawca link="https://www.image-line.com/">
          Image Line
        </wydawca>
        <dzialanie>
          <efekt>
            pogłos
          </efekt>
        </dzialanie>
        <obraz src="graphics/fimg(7).png"/>
      </plugin>

      <plugin nazwa="Fruity Reeverb 2" typ="efekt">
        <cena>
          0
        </cena>
        <wydawca link="https://www.image-line.com/">
          Image Line
        </wydawca>
        <dzialanie>
          <efekt>
            echo
          </efekt>
        </dzialanie>
        <obraz src="graphics/fimg(8).png"/>
      </plugin>

      <plugin nazwa="Guitar Rig 6" typ="efekt">
        <cena waluta="eur">
          199.00
        </cena>
        <wydawca link="https://www.native-instruments.com/en/">
          Native Instruments
        </wydawca>
        <dzialanie>
          <efekt>
            nasycenie
          </efekt>
          <efekt>
            korektor
          </efekt>
          <efekt>
            kompresor
          </efekt>
          <efekt>
            pogłos
          </efekt>
          <efekt>
            echo
          </efekt>
          <efekt>
            filtr
          </efekt>
        </dzialanie>
        <obraz src="graphics/fimg(9).png"/>
      </plugin>

      <plugin nazwa="iZotope Vinyl" typ="efekt">
        <cena>
          0
        </cena>
        <wydawca link="https://www.izotope.com/">
          iZotope
        </wydawca>
        <dzialanie>
          <synteza>
            sampler
          </synteza>
          <efekt>
            filtr
          </efekt>
        </dzialanie>
        <obraz src="graphics/fimg(10).png"/>
      </plugin>
    </pluginy>
  </elektroniczne>
  
  
  <fizyczne>
    <kontrolery>
      <kontroler>
        Klawisze MIDI
      </kontroler>
      <kontroler>
        Drumpad MIDI
      </kontroler>
      <kontroler>
        Gitara Elektryczna
      </kontroler>
      <kontroler>
        Pianino Elektryczne
      </kontroler>
    </kontrolery>
    <monitoryStudyjne>
      <monitor nazwa="HS" wersja="8" wzmocnienie="aktywny">
        <producent>
          Yamaha
        </producent>
      </monitor>
      <monitor nazwa="SCM" wersja="12" wzmocnienie="pasywny">
        <producent>
          ATC
        </producent>
      </monitor>
      <monitor nazwa="HS" wersja="7" wzmocnienie="aktywny">
        <producent>
          Yamaha
        </producent>
      </monitor>
      <monitor nazwa="Super Sound" wersja="5C" wzmocnienie="pasywny">
        <producent>
          Auratone
        </producent>
      </monitor>
    </monitoryStudyjne>
  </fizyczne>

  <teoria>
    <gatunki>
      <gatunek taneczny="tak" nazwa="House">
        <opis>
          Jeden z najpopularniejszych gatunków muzyki, rywalizujący swoją poularnością z rockem, hip-hopem a takż szeroko pojętym popem. Charakteryzuje się rytmem "4 on the floor" w którym każdy beat jest akcentowany bębnem basowym/bębnem wielkim. Dodatkowo w co drugi beat wpleciony jest werbel, a pmiędzy uderzeniami bębna wybrzmiewają otwarte talerze. Nadaje to utworowi dynamiki i taneczności. Mimo to przez przez powtarzalność perkusji można nałożyć na nią spokojniejsze instrumenty i osiągnąć bardziej spokojne doznanie np. w deep house czy też fragmentach progresywnego houseu. W takiej sytuacji często używa się także elementów muzyki "soul". Jest też druga strona Housea ze swoimi bardziej dynamicznymi odmianami takimi jak Electro House, French House, Bounce House. Istnieje także big room house którego celem jest po prostu brzmieć jak najgłośniej i wydawać się jak największy. Nie jest to najlepszy wybór do tańczenia ale może okazać się dobrym wyborem np. na duże festiwale. Natomiast większość pozostałych odmian houseu jest wręcz idealna na parkiet.
        </opis>
        <artysci>Alan_Walker Daft_Punk deadmau5 Swedish_House_Mafia Owl_City</artysci>
      </gatunek>
      <gatunek taneczny="nie" nazwa="Hip-Hop/rap">
        <artysci>Kendrick_Lamar Eminem Drake</artysci>
        <opis>